{
  "schema_version": "1.0.0",
  "profile_id": "cnil-fr",
  "profile_version": "1.0.0",
  "title": "CNIL France browser-test profile",
  "jurisdiction": "FR",
  "status": "ACTIVE",
  "sources": [
    {
      "source_id": "CNIL-CONSENT-UI-2026",
      "source_type": "REGULATOR_RECOMMENDATION",
      "authority": "Commission nationale de l'informatique et des libertes",
      "title": "Cookies et traceurs : comment mettre mon site web en conformite ?",
      "url": "https://cnil.fr/fr/cookies-et-autres-traceurs/regles/cookies/comment-mettre-mon-site-web-en-conformite",
      "section_locator": {"kind": "TEXT_BETWEEN", "start_marker": "Comment recueillir un consentement valide", "end_marker": "La CNIL propose ci-dessous un exemple"},
      "verification_method": "CONTENT_FINGERPRINT",
      "content_fingerprint": "656c7fdf75f51f1be8f3e826e9299760bf2e015ecbd800c2177e93b8f5e18588",
      "content_fingerprint_algo_version": "normalized-text-sha256-v1",
      "normalization_version": "visible-text-nfc-whitespace-v1",
      "volatile": true,
      "staleness_threshold_days": 90,
      "retrieved_at": "2026-08-18T12:00:00+02:00",
      "last_human_verified_at": "2026-08-18T12:00:00+02:00",
      "effective_date": null,
      "transition_deadline": null
    },
    {
      "source_id": "CNIL-AUDIENCE-RECOMMENDATIONS-2025",
      "source_type": "REGULATOR_RECOMMENDATION",
      "authority": "Commission nationale de l'informatique et des libertes",
      "title": "Cookies : solutions pour les outils de mesure d'audience",
      "url": "https://www.cnil.fr/fr/cookies-et-autres-traceurs/regles/cookies-solutions-pour-les-outils-de-mesure-daudience",
      "section_locator": {"kind": "TEXT_BETWEEN", "start_marker": "Les recommandations de la CNIL", "end_marker": "Certaines offres de mesure"},
      "verification_method": "CONTENT_FINGERPRINT",
      "content_fingerprint": "df61dcbb36bfb1cc701faf08576ad9b8b96a9eba5d945713423c8f3c9e841ddc",
      "content_fingerprint_algo_version": "normalized-text-sha256-v1",
      "normalization_version": "visible-text-nfc-whitespace-v1",
      "volatile": true,
      "staleness_threshold_days": 90,
      "retrieved_at": "2026-08-18T12:00:00+02:00",
      "last_human_verified_at": "2026-08-18T12:00:00+02:00",
      "effective_date": "2025-07-04",
      "transition_deadline": null
    },
    {
      "source_id": "CNIL-AUDIENCE-FAQ-2026",
      "source_type": "REGULATOR_INTERPRETATION",
      "authority": "Commission nationale de l'informatique et des libertes",
      "title": "Questions-reponses cookies et autres traceurs",
      "url": "https://cnil.fr/fr/cookies-et-autres-traceurs/regles/cookies/FAQ",
      "section_locator": {"kind": "TEXT_BETWEEN", "start_marker": "9. Les traceurs", "end_marker": "Les cookies de mesure"},
      "verification_method": "CONTENT_FINGERPRINT",
      "content_fingerprint": "72c68829d366a4cc14edb0230d57a1377561dde25d206cddc2ad0c948bce0fcd",
      "content_fingerprint_algo_version": "normalized-text-sha256-v1",
      "normalization_version": "visible-text-nfc-whitespace-v1",
      "volatile": true,
      "staleness_threshold_days": 90,
      "retrieved_at": "2026-08-18T12:00:00+02:00",
      "last_human_verified_at": "2026-08-18T12:00:00+02:00",
      "effective_date": "2026-04-29",
      "transition_deadline": null
    }
  ],
  "rules": [
    {
      "rule_id": "CNIL.FR.PRIOR.CHOICE",
      "source_ids": ["CNIL-CONSENT-UI-2026"],
      "title": "Prior choice for trackers that do not qualify for an exception",
      "applicability_facts": ["The observed operation is not strictly necessary", "No evidenced audience-measurement or other exception applies", "The FR profile applies to the tested visitor context"],
      "observable_test": "Compare non-necessary candidate requests, scripts, reads, and writes before choice and after rejection with accepted behaviour.",
      "expected_by_scenario": {"UNTOUCHED": "No applicable non-necessary candidate operation before an affirmative choice", "REJECTED": "No applicable non-necessary candidate operation after rejection", "ACCEPTED": "Operation may occur after the verified choice subject to purpose scope", "GRANULAR_DENIED": "Denied-purpose operation does not occur"},
      "exceptions": ["Strictly necessary operations", "Evidenced and applicable audience-measurement exception", "Advanced limited-data transport must be judged against its documented technical model rather than request presence alone"],
      "unobservable_dependencies": ["Controller purpose and lawful-basis records", "Unseen server processing", "Organizational exception conditions"],
      "legal_review_required": true,
      "superseded": false
    },
    {
      "rule_id": "CNIL.FR.CHOICE.EASE",
      "source_ids": ["CNIL-CONSENT-UI-2026"],
      "title": "Accept and reject are offered with comparable practical ease",
      "applicability_facts": ["The CNIL/FR profile applies", "The first-layer interface requests consent"],
      "observable_test": "Record the visible first-layer controls, semantic roles, interaction count, and whether reject requires additional layers relative to accept.",
      "expected_by_scenario": {"UNTOUCHED": "Accept and reject controls are both discoverable with comparable practical effort"},
      "exceptions": ["Contextual cookie-wall assessment requires DPO/legal judgment"],
      "unobservable_dependencies": ["Design intent", "Full accessibility conformance"],
      "legal_review_required": true,
      "superseded": false
    },
    {
      "rule_id": "CNIL.FR.WITHDRAWAL.ACCESS",
      "source_ids": ["CNIL-CONSENT-UI-2026"],
      "title": "Visitor can return to and withdraw the choice",
      "applicability_facts": ["A consent-based choice was previously accepted", "The FR profile applies"],
      "observable_test": "Locate the persistent preference mechanism, withdraw in the same context, verify updated state, and observe immediate and later browser behaviour.",
      "expected_by_scenario": {"ACCEPTED_TO_WITHDRAWN": "The preference mechanism is accessible and the withdrawn state is observable"},
      "exceptions": ["Already-loaded vendor code may continue automatic activity; record it rather than assuming stop"],
      "unobservable_dependencies": ["Vendor-side deletion", "Back-office receipt update"],
      "legal_review_required": true,
      "superseded": false
    },
    {
      "rule_id": "CNIL.FR.CHOICE.PERSISTENCE",
      "source_ids": ["CNIL-CONSENT-UI-2026"],
      "title": "Acceptance and refusal choices persist without repeated solicitation",
      "applicability_facts": ["The FR profile applies", "No contextual reason justifies a different renewal interval"],
      "observable_test": "Revisit accepted and rejected contexts, inspect choice-cookie expiry metadata, and compare suppression/restoration of the notice.",
      "expected_by_scenario": {"PERSISTENCE_ACCEPTED": "Accepted choice persists and is not requested on each page", "PERSISTENCE_REJECTED": "Rejected choice persists and is not requested on each page"},
      "exceptions": ["Six months is general CNIL guidance/good practice assessed case by case, not a universal statutory validity period"],
      "unobservable_dependencies": ["Back-office retention", "Long-term renewal behaviour beyond the sampled browser visit"],
      "legal_review_required": true,
      "superseded": false
    },
    {
      "rule_id": "CNIL.FR.AUDIENCE.EXEMPTION",
      "source_ids": ["CNIL-AUDIENCE-FAQ-2026", "CNIL-AUDIENCE-RECOMMENDATIONS-2025"],
      "title": "Claimed audience-measurement exception is tested only for observable conditions",
      "applicability_facts": ["The client or DPO asserts the specific audience-measurement exception", "Purpose is limited to audience measurement for the publisher", "No cross-service tracking or third-party reuse is asserted"],
      "observable_test": "Inspect tracker scope, domains, browser identifiers, opt-out behaviour, declared purpose, and cookie lifetime metadata; route organizational and downstream conditions for evidence.",
      "expected_by_scenario": {"UNTOUCHED": "Only the specifically asserted exempt setup may operate", "REJECTED": "Observable opt-out behaviour matches the asserted setup"},
      "exceptions": ["The 13-month value belongs to the audience-measurement recommendation context and is not a universal consent-validity period"],
      "unobservable_dependencies": ["Exclusive publisher purpose", "No vendor reuse", "Anonymous statistics", "No downstream cross-checking", "Transfer and contract conditions"],
      "legal_review_required": true,
      "superseded": false
    }
  ]
}
